{
  "$schema": "https://json-schema.org/draft/2020-12/schema",
  "$id": "https://local.codex/schemas/research_release_request.schema.json",
  "title": "Research Artifact Release v1 request",
  "description": "Closed input for deterministic local materialization of every exact file in one reviewed repository-first export. The standard-library helper enforces the cross-field, source/export hash, component, audience, and no-outbound invariants.",
  "type": "object",
  "additionalProperties": false,
  "required": [
    "schema_version",
    "record_type",
    "release_id",
    "release_version",
    "title",
    "purpose",
    "audience",
    "source_export_manifest_path",
    "source_export_manifest_sha256",
    "disclosure_review",
    "file_mappings",
    "component_declarations",
    "no_outbound_action",
    "automatic_claim_promotion"
  ],
  "properties": {
    "schema_version": {"type": "integer", "const": 1},
    "record_type": {"const": "research_release_request"},
    "release_id": {"$ref": "#/$defs/releaseId"},
    "release_version": {"$ref": "#/$defs/releaseVersion"},
    "title": {"$ref": "#/$defs/shortText"},
    "purpose": {"$ref": "#/$defs/text"},
    "audience": {"$ref": "#/$defs/audience"},
    "source_export_manifest_path": {"$ref": "#/$defs/exportManifestPath"},
    "source_export_manifest_sha256": {"$ref": "#/$defs/sha256"},
    "disclosure_review": {"$ref": "#/$defs/review"},
    "file_mappings": {
      "type": "array",
      "minItems": 1,
      "maxItems": 256,
      "items": {"$ref": "#/$defs/fileMapping"}
    },
    "component_declarations": {
      "type": "array",
      "minItems": 10,
      "maxItems": 10,
      "items": {"$ref": "#/$defs/componentDeclaration"}
    },
    "no_outbound_action": {"const": true},
    "automatic_claim_promotion": {"const": false}
  },
  "$defs": {
    "id": {
      "type": "string",
      "pattern": "^[A-Za-z0-9][A-Za-z0-9._-]{0,95}$"
    },
    "releaseId": {
      "description": "Portable lowercase release directory identifier, at most 96 characters, beginning and ending with an ASCII alphanumeric character and not naming a reserved DOS device.",
      "type": "string",
      "maxLength": 96,
      "pattern": "^[a-z0-9](?:[a-z0-9._-]{0,94}[a-z0-9])?$"
    },
    "releaseVersion": {
      "description": "Portable lowercase archive-version identifier that does not name a reserved DOS device. Hyphens are excluded so the canonical ZIP root remains unambiguous.",
      "type": "string",
      "maxLength": 96,
      "pattern": "^[a-z0-9](?:[a-z0-9._]{0,94}[a-z0-9])?$"
    },
    "sha256": {
      "type": "string",
      "pattern": "^[0-9a-f]{64}$"
    },
    "timestamp": {
      "type": "string",
      "pattern": "^\\d{4}-\\d{2}-\\d{2}T\\d{2}:\\d{2}:\\d{2}Z$"
    },
    "shortText": {
      "type": "string",
      "minLength": 1,
      "maxLength": 1024
    },
    "text": {
      "type": "string",
      "minLength": 1,
      "maxLength": 16384
    },
    "path": {
      "type": "string",
      "minLength": 1,
      "maxLength": 512,
      "pattern": "^(?!/)(?!.*(?:^|/)\\.\\.(?:/|$))(?!.*\\\\)(?!.*(?:^|/)\\.git(?:/|$))[^\\u0000-\\u001F\\u007F]+$"
    },
    "packagePath": {
      "description": "Normalized portable package path, at most 512 UTF-8 bytes overall. The helper additionally enforces NFC, a 255-byte UTF-8 limit per component, Windows device-name and trailing-dot/space exclusions, and whole-path NFKC-then-casefold-then-NFC equivalence for generated README/manifest and pairwise ancestor/descendant topology safety.",
      "type": "string",
      "minLength": 1,
      "maxLength": 512,
      "pattern": "^(?!/)(?!.*//)(?!.*\\/$)(?!(?:[Rr][Ee][Aa][Dd][Mm][Ee]\\.[Mm][Dd]|[Mm][Aa][Nn][Ii][Ff][Ee][Ss][Tt]\\.[Jj][Ss][Oo][Nn])(?:/|$))(?!.*(?:^|/)\\.{1,2}(?:/|$))(?!.*\\\\)(?!.*(?:^|/)\\.[Gg][Ii][Tt](?:/|$))(?!.*[<>:\"|?*])(?!.*(?:^|/)[^/]*[. ](?:/|$))[^\\u0000-\\u001F\\u007F]+$"
    },
    "exportManifestPath": {
      "type": "string",
      "maxLength": 512,
      "pattern": "^research/repository_first/exports/[A-Za-z0-9][A-Za-z0-9._-]{0,95}/manifest\\.json$"
    },
    "audience": {
      "enum": ["PRIVATE_REVIEW", "COAUTHOR", "SHAREABLE", "PUBLIC"]
    },
    "component": {
      "enum": [
        "MANUSCRIPT",
        "CLAIMS",
        "VERIFICATION",
        "SOURCES",
        "REPRODUCIBILITY",
        "CODE",
        "COMPUTATIONS",
        "FORMALIZATION",
        "CONTRIBUTIONS",
        "REVISIONS"
      ]
    },
    "role": {
      "enum": [
        "MANUSCRIPT_SOURCE",
        "COMPILED_MANUSCRIPT",
        "CLAIM_STATEMENT",
        "CLAIM_MAP",
        "CHECKPOINT",
        "VERIFICATION_REPORT",
        "SOURCE_RECORD",
        "BIBLIOGRAPHY",
        "REPRODUCIBILITY_GUIDE",
        "ENVIRONMENT_LOCK",
        "SOURCE_CODE",
        "COMPUTATION_INPUT",
        "COMPUTATION_OUTPUT",
        "FORMALIZATION_SOURCE",
        "FORMALIZATION_ARTIFACT",
        "CONTRIBUTION_RECORD",
        "REVISION_HISTORY"
      ]
    },
    "review": {
      "type": "object",
      "additionalProperties": false,
      "required": ["status", "reviewed_at_utc", "reviewer_role_ids", "scope_note"],
      "properties": {
        "status": {"const": "REVIEWED"},
        "reviewed_at_utc": {"$ref": "#/$defs/timestamp"},
        "reviewer_role_ids": {
          "type": "array",
          "minItems": 1,
          "maxItems": 32,
          "uniqueItems": true,
          "items": {"$ref": "#/$defs/id"}
        },
        "scope_note": {"$ref": "#/$defs/text"}
      }
    },
    "fileMapping": {
      "type": "object",
      "additionalProperties": false,
      "required": ["source_path", "package_path", "role", "purpose"],
      "properties": {
        "source_path": {"$ref": "#/$defs/path"},
        "package_path": {"$ref": "#/$defs/packagePath"},
        "role": {"$ref": "#/$defs/role"},
        "purpose": {"$ref": "#/$defs/shortText"}
      }
    },
    "componentDeclaration": {
      "type": "object",
      "additionalProperties": false,
      "required": ["component", "status", "paths", "rationale"],
      "properties": {
        "component": {"$ref": "#/$defs/component"},
        "status": {"enum": ["INCLUDED", "NOT_APPLICABLE", "OMITTED_REVIEWED"]},
        "paths": {
          "type": "array",
          "maxItems": 256,
          "uniqueItems": true,
          "items": {"$ref": "#/$defs/packagePath"}
        },
        "rationale": {
          "oneOf": [
            {"type": "null"},
            {"$ref": "#/$defs/text"}
          ]
        }
      }
    }
  }
}
